question,answer
 What are some examples of internalized trauma symptoms in adolescence?,These can include perfectionism procrastination obsessive-compulsive behavior suicidal ideation or a strong sense of worthlessness Many adolescents act like they are coping while silently sufferingâUnearthing and Overcomiâ¦
 How do addiction and compulsive behaviors relate to trauma?,Addiction to substances games or even suicidal ideation can serve as adaptive coping strategies to numb or avoid overwhelming emotional pain rooted in past traumaâUnearthing and Overcomiâ¦
 Why do trauma survivors often show both hyperactivity and shut-down behaviors?,Trauma dysregulates the nervous system Some children react with hyperarousal (eg rage or restlessness) while others become emotionally numb quiet or dissociatedâUnearthing and Overcomiâ¦
 How can caregivers begin to help a child showing trauma symptoms?,By recognizing these behaviors as cries for help not signs of rebellion or failure Offering empathy presence and validation is the first step to breaking the silence around their painâUnearthing and Overcomiâ¦
 What is the danger of ignoring trauma symptoms that seem mild or âphasesâ?,Unrecognized trauma symptoms may harden into lifelong psychological patterns including depression low self-worth or self-destructive behaviors if left unaddressedâUnearthing and Overcomiâ¦
 What is the overall takeaway from Chapter ?,Symptoms of Silent Trauma are often subtle misunderstood or normalized But behind them is real suffering that requires empathic intervention not judgment or dismissalâUnearthing and Overcomiâ¦
 How do symptoms of Silent Trauma evolve during adolescence?,They become more complex and internalized often showing up as procrastination perfectionism obsessive behaviors addiction or suicidal thoughtsfrequently misdiagnosed as personality flaws or disordersâUnearthing and Overcomiâ¦
 Why might a trauma-affected teen seem âlazyâ or unmotivated?,Lack of motivation is often rooted in deep emotional exhaustion What appears to be apathy may actually be a coping mechanism to shield from overwhelming painâUnearthing and Overcomiâ¦
 What does perfectionism in teens often mask?,Perfectionism can be a desperate attempt to regain a sense of control when a childs internal world feels chaotic due to unprocessed traumaâUnearthing and Overcomiâ¦
 What are some subtle behaviors that may be signs of deeper trauma?,Defiance sarcasm emotional withdrawal or passive-aggressive behavior can all signal unresolved trauma even if they seem like normal adolescent behaviorâUnearthing and Overcomiâ¦
 What more severe behavioral issues can emerge from unresolved trauma?,Adolescents may engage in bullying rule-breaking theft lying self-harm suicidal ideation or even homicidal thoughts as ways to cope with or express unacknowledged emotional painâUnearthing and Overcomiâ¦
 How is addiction often misunderstood in teens with trauma?,Addiction isnt just about substancesit can also be compulsive gaming social media use or obsessive control These behaviors offer a temporary escape from inner distressâUnearthing and Overcomiâ¦
 What role does obsessive-compulsive behavior play in trauma survivors?,It provides a sense of order and control over emotions that feel unpredictable and overwhelming acting as a defense mechanism to stabilize internal chaosâUnearthing and Overcomiâ¦
 Why might a teen become preoccupied with suicidal or violent fantasies?,These thoughts often reflect extreme internal despair and a lack of perceived emotional support They can be an attempt to express pain that the person feels no one can understandâUnearthing and Overcomiâ¦
 What does this chapter reveal about the root of these behaviors?,They are not simply âbad choicesâ or personality problems They are often desperate coping strategies shaped by unacknowledged trauma and emotional abandonmentâUnearthing and Overcomiâ¦
 How can caregivers and professionals shift their response to these behaviors?,By looking beneath the surface Instead of reacting with discipline or diagnosis they must lead with empathy understanding that each troubling behavior may carry a buried emotional woundâUnearthing and Overcomiâ¦
 What is the central message of Chapter ?,That parents and schools often re-traumatize children by punishing symptoms of Silent Trauma rather than addressing the underlying emotional wounds with empathy and understandingâUnearthing and Overcomiâ¦
 How do children with Silent Trauma often express their pain?,They may act out through compulsive behaviors aggression withdrawal or addictionnot because they are bad but because they dont know how to express their unspoken painâUnearthing and Overcomiâ¦
 Why are traditional punishments dangerous for trauma-affected children?,Punitive measures reinforce shame fear and isolation They fail to address the emotional roots of behavior deepening the trauma instead of resolving itâUnearthing and Overcomiâ¦
 What role do parents play in either healing or re-traumatizing their children?,Parents who fail to recognize the emotional motivations behind destructive behavior often respond harshly Those who take time to understand their childs pain can interrupt the cycle of re-traumatizationâUnearthing and Overcomiâ¦
 How can schools unintentionally re-traumatize children?,Disciplinary systems based on compliance and controllike detention or suspensioncan reinforce feelings of rejection especially when they ignore the childs emotional historyâUnearthing and Overcomiâ¦
 Why is understanding trauma history important before labeling a childs behavior?,Without knowing a childs background behavior that seems defiant or manipulative may actually be a cry for help Mislabeling leads to mistreatment and missed healing opportunitiesâUnearthing and Overcomiâ¦
 What is a trauma-informed approach in parenting and education?,Its a perspective that sees behavior as communication of emotional need It prioritizes empathy safety and emotional support over judgment or punishmentâUnearthing and Overcomiâ¦
 Why is emotional literacy critical for parents?,Parents need to recognize and respond to the emotional messages behind behavior Learning emotional language helps them build trust and emotional safety with their childrenâUnearthing and Overcomiâ¦
 What steps can parents take to prevent re-traumatization?,Observe with empathy validate feelings avoid quick punishment and create safe emotional spaces for children to express themselves without fear of rejectionâUnearthing and Overcomiâ¦
 What is the risk of failing to adopt a trauma-informed lens?,Children may continue to spiral into emotional pain developing more severe behavioral and psychological issues that could have been prevented with early empathic interventionâUnearthing and Overcomiâ¦
 Why are the first three years of a child's life so important emotionally?,These years form the core foundation of a childs emotional development The childs sense of trust safety and emotional security is formed through early caregiver relationships during this critical windowâUnearthing and Overcomiâ¦
 What makes children between ages  and  especially vulnerable to Silent Trauma?,At this age children cannot express their needs verbally or process events rationally They rely completely on emotional attunement from caregivers Any inconsistency neglect or emotional absence may be internalized as traumaâUnearthing and Overcomiâ¦
 How does separation from a primary caregiver during these years affect a child?,Even brief or seemingly harmless separations can generate intense anxiety or a sense of abandonment in a child disrupting their emerging ability to trust others and themselvesâUnearthing and Overcomiâ¦
 Why are ordinary life events (eg a new sibling or changing nannies) sometimes traumatic at this age?,What may appear as routine changes to adults can feel like a profound loss to the infant The child may interpret these events as rejection or abandonment forming emotional blueprints of insecurityâUnearthing and Overcomiâ¦
 What kinds of emotional responses might babies show when experiencing Silent Trauma?,Responses may include excessive crying feeding or sleep disturbances physical clinginess withdrawal or later regression in behavior (eg returning to bedwetting or baby talk)âUnearthing and Overcomiâ¦
 How does the childs brain development make them more susceptible to trauma during this time?,The brain undergoes rapid growth and neural wiring in these early years Emotional experiences both positive and negative have a disproportionate influence on how brain systems responsible for memory emotion and attachment are shapedâUnearthing and Overcomiâ¦
 Can trauma at this stage be âforgottenâ by the child?,While the child may not consciously remember the event the emotional memory remains stored in the body and subconscious influencing behavior and relationships throughout lifeâUnearthing and Overcomiâ¦
 What role does consistent emotional care play during this stage?,Reliable warm and emotionally available care helps the child develop secure attachment This provides resilience against later stress and lays the groundwork for emotional regulationâUnearthing and Overcomiâ¦
 What is the takeaway message for caregivers of infants and toddlers?,Every moment of caregivingfeeding soothing eye contactshapes a childs emotional landscape Early emotional attunement prevents the formation of Silent Trauma and promotes long-term mental healthâ
 Why is separation anxiety such a major source of Silent Trauma?,For young children separation from a primary caregiver can trigger a powerful sense of abandonment insecurity and loss If the caregiver is not emotionally present to soothe the child this experience may become internalized as traumaâUnearthing and Overcomiâ¦
 What emotional impact does early separation have on infants?,Infants may not yet understand time or intent So even short separations can feel like abandonment If repeated or unaddressed these moments can erode the child's ability to form secure attachmentsâUnearthing and Overcomiâ¦
 How does unconditional love act as a protective shield against trauma?,When a child knows they are loved no matter what even during separation or emotional turbulence they feel safe and supported This emotional safety acts as a buffer against the formation of traumaâUnearthing and Overcomiâ¦
 Can ordinary life transitions create trauma for children?,Yes Events like starting daycare a parent traveling or new caregivers can be traumatic if the child doesnt feel emotionally held or understood during the transitionâUnearthing and Overcomiâ¦
 Why is emotional attunement during separation essential?,Attuned caregivers acknowledge the childs distress and respond with comfort and validation This helps the child process their feelings and strengthens their sense of trust and securityâUnearthing and Overcomiâ¦
 What happens if separation is paired with emotional unavailability?,The child may not only grieve the separation but also internalize the idea that their needs dont matter This combination can become a core wound influencing future attachment stylesâUnearthing and Overcomiâ¦
 How can parents support children during necessary separations?,By preparing the child offering reassurance establishing consistent routines and maintaining emotional connectioneven from a distancesuch as through video calls notes or ritualsâUnearthing and Overcomiâ¦
 Whats the takeaway for modern parents managing separation-related situations?,Parents must stay emotionally available even when physically apart Acts of unconditional love consistency and validating emotions are essential to reducing long-term emotional scarsâUnearthing and Overcomiâ¦
 Can children be traumatized just by witnessing arguments or violence between their parents?,Yes Children who witness parental conflicteven without being directly harmedoften internalize fear anxiety and a sense of emotional instability which can become deep-rooted Silent TraumaâUnearthing and Overcomiâ¦
 What are the emotional effects of witnessing domestic violence at a young age?,Even at age one a child like Jacob may experience emotional abandonment confusion and terror These feelings can disrupt their sense of safety and leave invisible but lasting emotional scarsâUnearthing and Overcomiâ¦
 Why is witnessing violence considered a form of emotional abuse?,Because it violates the childs basic need for safety and predictability Witnessing such conflict creates a high-stress environment that can impair emotional developmentâUnearthing and Overcomiâ¦
 How does parental conflict overshadow a childs emotional needs?,When parents are emotionally overwhelmed or fighting the childs needs for comfort and attention are often ignored creating a feeling of emotional neglecteven if unintentionalâUnearthing and Overcomiâ¦
 What kinds of behavioral changes may occur in children exposed to parental conflict?,They may become withdrawn fearful or anxious Their playfulness may diminish and they may show signs of insecurity or over-cautiousness even in safe environmentsâUnearthing and Overcomiâ¦
 Is there lasting psychological impact even if the conflict is brief?,Yes Even a single intense incidentlike a parent threatening to harm themselves during a fightcan fracture the childs emotional safety and lead to long-term trauma symptomsâUnearthing and Overcomiâ¦
 How might a child interpret these events even if they don't understand the words?,A child doesn't need to understand the details to absorb the emotional tension Tone volume facial expressions and body language communicate danger and distress clearly to themâUnearthing and Overcomiâ¦
 What forms of trauma can result from witnessing parental turmoil?,These include emotional neglect emotional abuse (through exposure) and even perceived physical abandonment if a parent becomes emotionally unavailable during conflictâUnearthing and Overcomiâ¦
 Why is early intervention critical for children who witness these events?,Without support the trauma may go unrecognized and compound over time Early empathy-based interventions help children process what they experienced and restore emotional safetyâUnearthing and Overcomiâ¦
 What is the main message of this chapter?,Parental conflictespecially unresolved or recurringcan deeply scar a child's emotional world Caregivers must protect children from witnessing such turmoil and prioritize emotional healing when it occursâUnearthing and Overcomiâ¦
 Can the arrival of a new sibling cause trauma in the older child?,Yes Though common sibling rivalry can create feelings of emotional abandonment jealousy or confusion in the older child especially if the attention they once received is suddenly shifted to the newbornâUnearthing and Overcomiâ¦
 Why is the early transition period after a siblings birth so emotionally intense for toddlers?,Toddlers still require a high degree of emotional attunement When a new sibling arrives the decrease in one-on-one attention may feel like rejection which they cannot verbally express leading to Silent TraumaâUnearthing and Overcomiâ¦
 What are signs that an older sibling may be experiencing emotional distress after a new baby arrives?,Increased clinginess emotional withdrawal regressive behavior acting out or loss of interest in previously enjoyed activities may indicate trauma from perceived neglectâUnearthing and Overcomiâ¦
 Is sibling rivalry always harmless or normal?,No While rivalry is expected unresolved emotional pain from shifting family dynamics can lead to long-term relational difficulties attachment insecurity or resentmentâUnearthing and Overcomiâ¦
 How does emotional abandonment differ from physical abandonment in this context?,Emotional abandonment occurs when the child feels the emotional bond with their caregiver is broken even if the parent is physically present This can happen when emotional energy is redirected to the newborn without reassurance to the older childâUnearthing and Overcomiâ¦
 How can a parent mitigate emotional trauma during this transition?,Parents can intentionally set aside one-on-one time validate the older childs feelings and maintain rituals that reinforce their continued importance and emotional safetyâUnearthing and Overcomiâ¦
 Why does the childs emotional world shift so dramatically after a sibling is born?,The childs sense of security was tied to consistent emotional connection When that bond is interruptedeven unintentionallythe child may feel displaced or forgottenâUnearthing and Overcomiâ¦
 What parenting mistakes often exacerbate sibling-related trauma?,Assuming the older child will âadjust naturallyâ minimizing their distress or scolding them for needing attention can all deepen their sense of emotional abandonmentâUnearthing and Overcomiâ¦
 Can sibling-related trauma lead to changes in a childs development?,Yes Emotional neglect during this critical stage may impact attachment style social development emotional regulation and even self-worth later in lifeâUnearthing and Overcomiâ¦
 What is the central message of Chapter ?,Even joyful life events like the birth of a sibling can trigger Silent Trauma in young children Parents must remain emotionally present and aware to protect all children from feeling unseen or unloved during such transitionsâUnearthing and Overcomiâ¦
 What does this chapter suggest is the root of many mental health disorders?,Silent Trauma in early childhoodespecially emotional abandonment neglect and lack of empathetic caregivingoften underlies depression anxiety suicidal ideation and even acts of violence later in lifeâUnearthing and Overcomiâ¦
 Why do many people with depression not remember a specific traumatic event?,Because Silent Trauma is often emotional rather than physical its stored in emotional memory rather than explicit memory People remember the feelings (loneliness fear) but not always the events that caused themâUnearthing and Overcomiâ¦
 How does emotional disconnection relate to depression?,Depression is often a state of disconnection from self and others frequently rooted in early childhood experiences of emotional neglect or unresponsiveness from caregiversâUnearthing and Overcomiâ¦
 What does Freud say about the origin of psychopathology?,Freud noted that unresolved trauma especially the anxiety from early separation from the caregiver can serve as a catalyst for neurotic symptoms and later psychopathological conditionsâUnearthing and Overcomiâ¦
 Can trauma survivors unconsciously attempt to âundoâ their early trauma?,Yes According to Freud and other scholars individuals often unconsciously reenact trauma or develop symptoms in an attempt to resolve unresolved emotional painâUnearthing and Overcomiâ¦
 What does Michael Rutter identify as essential trauma-preventive parenting elements?,Rutter emphasizes stability in attachment figures warm relationships and immediate emotional availability during a crisis These factors serve as protective barriers against psychopathologyâUnearthing and Overcomiâ¦
 How do early trauma symptoms evolve if left unrecognized?,They can mature into depression OCD ADHD eating disorders conduct disorders or even antisocial or violent behaviors in adolescence and adulthoodâUnearthing and Overcomiâ¦
 Why is it important to understand traumas role in disorders like addiction or suicide?,Misdiagnosing trauma-based symptoms as character flaws or chemical imbalances misses the opportunity for healing Trauma-informed care offers a more compassionate and accurate path to recoveryâUnearthing and Overcomiâ¦
 What long-term patterns may form due to trauma-induced attachment issues?,Individuals may develop personality disorders impaired emotional regulation identity confusion or rely on destructive coping mechanisms like addiction avoidance or controlâUnearthing and Overcomiâ¦
 What is the call to action from this chapter?,To recognize that many mental illnesses have roots in Silent Trauma and that effective healing requires a shift from judgment or quick diagnosis to deep empathy safe relationships and trauma-informed support systemsâUnearthing and Overcomiâ¦
 What is maternal deprivation?,Maternal deprivation refers to a childs experience of physical or emotional separation from their primary caregiveroften the motherduring critical early development This absence can lead to deep lasting psychological woundsâUnearthing and Overcomiâ¦
 Why is the absence of the mother during the first three years especially damaging?,The first three years are critical for forming secure attachment Without the consistent presence of a loving attuned caregiver the child may feel abandoned leading to attachment disorders and emotional dysregulationâUnearthing and Overcomiâ¦
 What are the short-term stages observed in infants experiencing maternal deprivation?,According to Michael Rutters findings infants first cry and protest the loss then enter a state of misery and apathy and eventually detach emotionally from the mother appearing disinterested or indifferentâUnearthing and Overcomiâ¦
 What are the long-term effects of maternal deprivation?,It can result in depression anxiety perfectionism OCD ADHD addiction eating disorders personality disorders suicidal ideation and even violent behaviors such as mass shootings or serial killings in extreme casesâUnearthing and Overcomiâ¦
 Can maternal deprivation cause physical symptoms in children?,Yes Somatic complaints like chronic headaches stomach issues and sleep disturbances can be psychosomatic expressions of underlying emotional distress caused by maternal separationâUnearthing and Overcomiâ¦
 Should parents feel guilty for not knowing these effects earlier?,No The book emphasizes that Silent Traumas often operate beneath the surface and may go unnoticed by even loving and competent caregivers Awarenessnot blameis key to healingâUnearthing and Overcomiâ¦
 Why do children rarely talk about trauma right away?,Trauma affects trust Children may suppress or disconnect from painful experiences especially if they associate the parent with the original injury or fear being disbelievedâUnearthing and Overcomiâ¦
 How does maternal deprivation affect attachment?,It can cause a child to form insecure or disorganized attachments leading to either clinginess or emotional avoidance in later relationshipsâUnearthing and Overcomiâ¦
 How might maternal deprivation contribute to perfectionism in teens?,Teens may seek control and approval as a way to compensate for deep feelings of insecurity and unworthiness caused by early emotional abandonmentâUnearthing and Overcomiâ¦
 Can a child recover from maternal deprivation later in life?,Yes Healing is possible through empathic relationships therapy and emotionally corrective experiences that rebuild trust and repair early emotional woundsâUnearthing and Overcomiâ¦
 How can a routine hospital stay cause Silent Trauma in an infant?,Case  describes a nine-month-old hospitalized for a week Though medically necessary the absence of her parents led to emotional withdrawal and a loss of sparksigns of perceived abandonment and emotional neglectâUnearthing and Overcomiâ¦
 Can being cared for by a loving neighbor still traumatize a child?,Yes Case  shows that even in a warm attentive environment a child like Lily may feel a void when separated from her mother No one can replace the unique emotional bond between mother and childâUnearthing and Overcomiâ¦
 What happens when children are raised by nannies or maids?,In Case  while the child receives care the frequent absence of emotionally present parents may lead to feelings of neglect and emotional insecurity especially when caregivers rotate frequentlyâUnearthing and Overcomiâ¦
 How can a grandparents care cause trauma despite best intentions?,In Case  the child bonds with a grandmother while parents are away but then experiences separation trauma when the mother returns Attachment confusion and disrupted bonding are common outcomesâUnearthing and Overcomiâ¦
 Why is reuniting with parents after separation not always simple?,Case  reveals that even joyful reunions can trigger emotional resistance or withdrawal The child may feel unsure whether to trust again after a painful separationâUnearthing and Overcomiâ¦
 Can surgery cause trauma even with survival?,Yes In Case  emergency surgery created panic and a sense of abandonment when the child woke without their parents Medical trauma often overlaps with emotional trauma if not supported empathically afterwardâUnearthing and Overcomiâ¦
 What is the impact of witnessing domestic violence as a toddler?,In Case  a one-year-old boy witnessed his mother being abused Though not physically harmed he absorbed the fear and instability which deeply shaped his emotional worldâUnearthing and Overcomiâ¦
 How does the birth of a sibling create trauma?,Case  explores how a previously secure child may feel replaced or forgotten The loss of exclusive attention can feel like emotional abandonment especially without reassuranceâUnearthing and Overcomiâ¦
