question,answer
 What is the main idea behind the Origin of Trauma Model?,This model suggests that many emotional and behavioral problems in adulthoodsuch as anxiety depression addiction or violenceoften originate from unresolved emotional wounds in early childhood
 What is Silent Trauma and why is it so dangerous?,Silent trauma refers to emotional pain caused by subtle but chronic experiences of emotional neglect disconnection or unrecognized harm Its dangerous because it leaves no visible scars often goes unacknowledged and silently distorts ones sense of self
 Can you have Silent Trauma even if you had good parents?,Yes Silent Trauma often stems from emotionally unavailable parenting even in families that appear functional or loving on the surface Emotional neglect or lack of empathyintentional or notcan still deeply wound a child
 What are some examples of Silent Trauma in childhood?,Being left alone in a hospital being raised by a distracted or depressed caregiver or constantly feeling unheard or misunderstood are all examples These situations can cause a child to internalize shame or abandonment
 Why do people often fail to recognize Silent Trauma in themselves?,Because it doesnt involve overt abuse many survivors dismiss their pain or compare it to more obvious traumas They may feel guilty for feeling hurt or not even realize their childhood experiences were harmful
 How does Silent Trauma affect our adult relationships?,People with unhealed Silent Trauma may struggle with trust feel overly sensitive to rejection become emotionally distant or fall into repeating painful relationship patterns
 Why is early childhood such a critical time for trauma to occur?,During the first few years a childs brain and sense of self are developing rapidly Emotional wounds in this period become âblueprintsâ for how the child sees themselves and others throughout life
 Can a well-meaning parent still cause trauma?,Absolutely Even loving parents can pass on trauma if they are emotionally unaware dismissive of a childs feelings or overly focused on discipline or achievement rather than connection
 What happens when children are unable to express their emotional pain?,They may internalize it as shame or anger Over time it can manifest as anxiety perfectionism compulsive behaviors low self-esteem or even violent tendencies in extreme cases
 How is Silent Trauma related to the development of later disorders like depression or addiction?,The unresolved pain from Silent Trauma often leads people to seek ways to numb or escape their feelings which can evolve into depression addiction or other maladaptive coping strategies
 Why is society often blind to the effects of Silent Trauma?,Society tends to focus on visible trauma like abuse or violence Emotional neglect is harder to identify especially when it happens in otherwise ânormalâ or âsuccessfulâ families
 What is the long-term consequence of not addressing Silent Trauma?,Without awareness and healing Silent Trauma continues to shape a persons life choices mental health relationships and even parenting patternsoften perpetuating the cycle of trauma across generations
 How does empathic parenting help prevent or heal Silent Trauma?,Empathic parenting offers emotional presence validation and unconditional support This creates a safe space for the child to express their pain develop a healthy sense of self and begin the healing process
 Why do conventional parenting styles often fail to help children with trauma?,Traditional approaches like authoritarian permissive neglectful or over-involved parenting often miss or even worsen a childs emotional wounds These styles fail to address the deep emotional needs of trauma survivors
 Whats the danger of using authoritarian parenting with a traumatized child?,Authoritarian parenting uses fear and control which can recreate the very powerlessness the child experienced during trauma leading to anger rebellion or even violence in adolescenceâUnearthing and Overcomiâ¦
 How does permissive parenting affect children with trauma?,Giving children too much freedom without boundaries can overwhelm them leading to anxiety abuse of power and even lashing out at others as a form of misplaced revenge for past emotional painâUnearthing and Overcomiâ¦
 What is achievement-oriented or neglectful parenting and how can it cause harm?,This style uses monetary rewards to make up for emotional neglect Children raised this way often feel insignificant and may develop narcissistic or competitive traits to seek validationâUnearthing and Overcomiâ¦
 Can well-meaning parents still traumatize their children?,Yes Even loving but unaware parents may cause harm by failing to understand their childs emotional needs or by relying on ineffective parenting styles rooted in control avoidance or fearâUnearthing and Overcomiâ¦
 What emotional message does neglectful parenting send to the child?,It tells the child that money and performance matter more than their feelings This creates a deep sense of unimportance fueling emotional detachment anger and resentment later in lifeâUnearthing and Overcomiâ¦
 How does âhelicopterâ or over-involved parenting become harmful?,Over-involvement while appearing helpful can ignore the childs need to first feel understood Constant pressure to succeed without emotional support can make fear and anxiety spiral into hostilityâUnearthing and Overcomiâ¦
 What is the danger of not tailoring parenting to trauma survivors?,Trauma survivors are often emotionally younger than their age Applying standard discipline or expectations can deepen their wounds rather than help them grow
 How do conventional parenting styles overlook emotional regulation?,Many styles focus on obedience achievement or independence but neglect emotional literacy Children dont learn how to process their feelings safely leaving them to act out or shut down
 Whats the core message of this chapter for parents?,Parenting traumatized children requires more than rules and rewards It demands empathy emotional presence and an understanding that children act out when they feel unseen or misunderstood
 Why do conventional parenting styles often fail to help children with trauma?,Traditional approaches like authoritarian permissive neglectful or over-involved parenting often miss or even worsen a childs emotional wounds These styles fail to address the deep emotional needs of trauma survivors
 Whats the danger of using authoritarian parenting with a traumatized child?,Authoritarian parenting uses fear and control which can recreate the very powerlessness the child experienced during trauma leading to anger rebellion or even violence in adolescenceâUnearthing and Overcomiâ¦
 How does permissive parenting affect children with trauma?,Giving children too much freedom without boundaries can overwhelm them leading to anxiety abuse of power and even lashing out at others as a form of misplaced revenge for past emotional painâUnearthing and Overcomiâ¦
 What is achievement-oriented or neglectful parenting and how can it cause harm?,This style uses monetary rewards to make up for emotional neglect Children raised this way often feel insignificant and may develop narcissistic or competitive traits to seek validationâUnearthing and Overcomiâ¦
 Can well-meaning parents still traumatize their children?,Yes Even loving but unaware parents may cause harm by failing to understand their childs emotional needs or by relying on ineffective parenting styles rooted in control avoidance or fearâUnearthing and Overcomiâ¦
 What emotional message does neglectful parenting send to the child?,It tells the child that money and performance matter more than their feelings This creates a deep sense of unimportance fueling emotional detachment anger and resentment later in lifeâUnearthing and Overcomiâ¦
 How does âhelicopterâ or over-involved parenting become harmful?,Over-involvement while appearing helpful can ignore the childs need to first feel understood Constant pressure to succeed without emotional support can make fear and anxiety spiral into hostilityâUnearthing and Overcomiâ¦
 What is the danger of not tailoring parenting to trauma survivors?,Trauma survivors are often emotionally younger than their age Applying standard discipline or expectations can deepen their wounds rather than help them grow
 How do conventional parenting styles overlook emotional regulation?,Many styles focus on obedience achievement or independence but neglect emotional literacy Children dont learn how to process their feelings safely leaving them to act out or shut down
 Whats the core message of this chapter for parents?,Parenting traumatized children requires more than rules and rewards It demands empathy emotional presence and an understanding that children act out when they feel unseen or misunderstood
 How can a small event like a playground injury become a source of trauma?,Its not just the injury that mattersit's how the caregiver responds If the child feels abandoned or unsupported during their pain they may associate that moment with emotional abandonment which leaves a deeper scar than the injury itselfâUnearthing and Overcomiâ¦
 Why are early experiences with caregivers so critical in shaping emotional memory?,In moments of fear or pain a child instinctively seeks their caregiver When that support is missing the experience is encoded as emotional abandonment even if the situation seemed minorâUnearthing and Overcomiâ¦
 Can science definitively prove the link between early trauma and adult symptoms?,No Ethical limitations prevent invasive research on infants and brain imaging while helpful cant establish absolute cause-effect relationships Yet mounting observational and clinical evidence confirms early traumas impact on long-term mental healthâUnearthing and Overcomiâ¦
 What common thread did researchers find among mass shooters?,Many mass shooters experienced early childhood trauma or exposure to violence This hidden pain is often unrecognized or untreated contributing to severe mental health crises later in lifeâUnearthing and Overcomiâ¦
 Why dont teachers or doctors always recognize early trauma?,Despite good intentions many professionals lack training in trauma-informed care Subtle emotional distress in young children can go unnoticed or be misinterpreted as behavioral issuesâUnearthing and Overcomiâ¦
 Why are parents sometimes reluctant to explore trauma as the cause of a childs struggles?,Parents may fear being blamed or uncovering their own unresolved pain Theres also widespread stigma around therapy and mental health which can delay or prevent interventionâUnearthing and Overcomiâ¦
 What does Gabor MatÃ© say about the root of addiction?,Gabor MatÃ© asserts that traumanot the substance itselfis often the real root of addiction People use substances to numb pain that usually traces back to unhealed childhood woundsâUnearthing and Overcomiâ¦
 How did Alice Miller explain cruelty in adulthood like in the case of Hitler?,Miller linked overt cruelty and psychopathy in adulthood to childhood abuse and emotional neglect emphasizing how untreated trauma can lead to devastating outcomesâUnearthing and Overcomiâ¦
 Why is it so important to address trauma that seems âsilentâ or subtle?,Because these traumas often go unnoticed they remain untreated subtly shaping personality mental health and behavior for a lifetime Recognizing them early can change the entire trajectory of a persons emotional developmentâUnearthing and Overcomiâ¦
 What is the authors ultimate message in this chapter?,Even seemingly small moments can create lifelong emotional imprints Caregivers clinicians and society must recognize and validate the silent cries of children before they manifest as adult suffering or societal tragedyâ
 Why does traditional authoritative parenting often fail trauma survivors?,It emphasizes discipline and consequences without addressing emotional wounds This rigid behavior-focused model may re-trigger trauma rather than support healingâUnearthing and Overcomiâ¦
 How can disciplinary consequences re-traumatize a child?,Consequences given without empathy can make a child feel powerless ashamed and unloved reinforcing the emotional pain they already carryâUnearthing and Overcomiâ¦
 Whats wrong with teaching responsibility through consequences for traumatized children?,It assumes the child is developmentally ready to understand consequences but trauma arrests emotional growth These children need healing and empathy before they can internalize responsibilityâUnearthing and Overcomiâ¦
 What is Roland Kims Stage  parenting system?,Its a parenting approach rooted in empathy rehabilitation and emotional understanding allowing space for the childs growth correction and healing rather than punishmentâUnearthing and Overcomiâ¦
 What does Stage  parenting emphasize that Stage  does not?,Stage  emphasizes emotional development flexibility and rehabilitation while Stage  enforces rigid consequences based on personal responsibility often ignoring traumaâUnearthing and Overcomiâ¦
 Why is empathy essential when dealing with trauma survivors?,Empathy validates their pain helps rebuild trust and creates the emotional safety needed for recovery Without empathy traumatized individuals often feel misunderstood or rejectedâUnearthing and Overcomiâ¦
 How did Chris Harper-Mercers story illustrate the failure of consequence-based parenting?,His mothers focus on independence and punishment neglected his emotional pain This emotionally distant approach may have intensified his isolation and suffering contributing to tragic outcomesâUnearthing and Overcomiâ¦
 Why do many mass shooters share a background of trauma and lack of empathy?,Unaddressed trauma coupled with emotionally disconnected parenting or societal responses creates deep psychological pain that can explode into destructive behaviorsâUnearthing and Overcomiâ¦
 What is the long-term risk of ignoring emotional wounds in children?,If unacknowledged and unhealed these wounds can manifest as severe mental health issues addiction violence or suicide in adolescence and adulthoodâUnearthing and Overcomiâ¦
 How can parents shift from re-traumatizing to healing their children?,By replacing judgment with curiosity punishment with understanding and authority with connection Healing begins when the child feels emotionally safe and understoodâUnearthing and Overcomiâ¦
 What is the role of society in preventing re-traumatization?,Schools healthcare systems and communities must adopt trauma-informed approaches that prioritize emotional understanding over behavioral correctionâUnearthing and Overcomiâ¦
 Can empathy be taught to parents who were never shown it?,Yes Through self-reflection therapy and education parents can learn to recognize their emotional blind spots and begin offering the connection their child needsâUnearthing and Overcomiâ¦
 What is the overall takeaway of Chapter ?,Trauma survivors need more than rulesthey need to be seen heard and understood Empathic parenting is not soft or permissiveit is emotionally rigorous and necessary for breaking cycles of silent traumaâUnearthing and Overcomiâ¦
 Is a childs rage usually the root problem?,No Rage is rarely the beginning of the issueit is often the result of long-term emotional pain neglect and unmet needs Its a symptom of Silent Trauma thats been building beneath the surfaceâUnearthing and Overcomiâ¦
 Why does fear-based parenting often lead to rage in children?,Authoritarian parenting uses fear and control which mirrors the powerlessness children felt during their original trauma Over time this creates unresolved anger that eventually erupts as rageâUnearthing and Overcomiâ¦
 How does repressed trauma show up during adolescence?,It often manifests as aggression rebellion or impulsive behavior When teens gain more power and autonomy previously suppressed rage may explode especially if their pain hasnt been recognized or validatedâUnearthing and Overcomiâ¦
 Why do traumatized children often lash out at caregivers?,When children feel emotionally abandoned or misunderstood they may direct their suppressed pain and resentment toward the very people they wish would care for themespecially caregivers who failed to empathizeâUnearthing and Overcomiâ¦
 What happens when children feel they are valued for money or achievements instead of love?,They may feel worthless or used Over time this can lead to deep-seated resentment especially when parents try to substitute emotional connection with monetary rewardsâUnearthing and Overcomiâ¦
 Can permissive parenting also lead to rage or manipulative behavior?,Yes Giving children too much power without emotional guidance can leave them feeling overwhelmed insecure and vengeful They may act out to regain control or seek revenge for past emotional injuriesâUnearthing and Overcomiâ¦
 Why are rules and consequences often ineffective for trauma survivors?,Rules without emotional understanding feel like more rejection Trauma survivors need empathy and connection before they can develop a healthy sense of responsibilityâUnearthing and Overcomiâ¦
 What kind of parenting approach does the author recommend instead?,A trauma-informed approach based on Stage  Parenting which centers on empathy emotional rehabilitation and re-connection before disciplineâUnearthing and Overcomiâ¦
 What long-term effects can unresolved childhood rage have?,It can evolve into adult aggression antisocial behavior or even violence Left unchecked these patterns may continue into future relationships or parenting stylesâUnearthing and Overcomiâ¦
 How can caregivers begin to heal a childs rage?,By seeing rage as a cry for help not as defiance Validating the childs pain asking about their emotional world and offering consistent emotional presence are key steps to transformationâUnearthing and Overcomiâ¦
 What does it mean to re-traumatize a child?,Re-traumatization occurs when a child's emotional pain is misunderstood ignored or punished Instead of healing the child relives feelings of abandonment fear or shame from the original traumaâThe Fathers Guide Engliâ¦
 Why is it harmful to interpret a childs acting out as merely bad behavior?,Children often act out to express pain they can't verbalize Labeling this as misbehavior overlooks the root cause and invites punishment instead of supportâThe Fathers Guide Engliâ¦
 How do traditional parenting methods contribute to re-traumatization?,Approaches like harsh discipline forced compliance or ignoring emotional needs can trigger old wounds and reinforce a childs belief that they are not safe or lovedâThe Fathers Guide Engliâ¦
 Why is punishment ineffective for children with trauma?,Punishment may reinforce feelings of rejection and powerlessness These children need empathy and connection to regulate emotions not fear-based disciplineâThe Fathers Guide Engliâ¦
 What does âtherapeutic parentingâ mean in this context?,Therapeutic parenting is a trauma-informed approach that prioritizes emotional connection co-regulation and empathy It recognizes that healing must come before disciplineâThe Fathers Guide Engliâ¦
 How can caregivers better respond when a child âacts outâ?,Pause and reflect: âWhat pain is this behavior expressing?â Instead of reacting with anger or control offer emotional presence and safety to help the child feel understoodâThe Fathers Guide Engliâ¦
 What role do schools and institutions play in re-traumatizing children?,Strict discipline policies public shaming or detentions can deepen a child's emotional wounds especially if they already carry unspoken pain from home or past traumaâThe Fathers Guide Engliâ¦
 Why is empathy not the same as permissiveness?,Empathy acknowledges the childs pain while still setting boundaries Permissiveness avoids both discipline and emotional connection while empathy combines compassion with guidanceâThe Fathers Guide Engliâ¦
 Whats the danger of mislabeling trauma responses as disorders like ADHD or oppositional defiance?,It can lead to medication or misdiagnosis without ever addressing the underlying emotional wounds True healing requires understanding the trauma history not just treating symptomsâThe Fathers Guide Engliâ¦
 How can parents begin breaking the cycle of re-traumatization?,By shifting from reactive parenting to reflective parentinglearning to pause empathize and meet their childs emotional needs rather than reacting with anger or controlâThe Fathers Guide Engliâ¦
 What is the key takeaway from Chapter ?,Children in pain dont need correctionthey need connection The path to healing begins when we stop punishing pain and start listening to itâThe Fathers Guide Engliâ¦
 What is one of the most common forms of Silent Trauma described in this chapter?,The sudden loss of unconditional lovesuch as when a primary caregiver is replaced by someone unfamiliarcan deeply disturb a childs emotional foundation and create lasting traumaâUnearthing and Overcomiâ¦
 Why can a change in caregiver during early childhood be traumatic?,A substitute caregiver may not offer the same emotional warmth or understanding This shift can create anxiety and feelings of abandonment especially between the ages of  and  when trust is still formingâUnearthing and Overcomiâ¦
 How does witnessing family conflict affect children emotionally?,Seeing or hearing parental arguments threats or physical violenceeven if not directed at the childcan make the child feel unsafe and insecure This existential fear can linger well into adulthoodâUnearthing and Overcomiâ¦
 Why is neglected attention a form of trauma?,When a new sibling or family member diverts attention from a child the child may feel pushed aside leading to feelings of rejection or loss of importance in the family structureâUnearthing and Overcomiâ¦
 How might Silent Traumas appear âharmlessâ to outside observers?,These traumas often happen during routine life transitions such as caregiver changes or family growth and are not always viewed as harmful But for the child they can have a profound emotional impactâUnearthing and Overcomiâ¦
 Whats the danger of dismissing a childs feelings during life transitions?,Children who are told to get over it or stop being dramatic learn to silence their pain which builds unresolved emotional wounds that affect self-worth and future relationshipsâUnearthing and Overcomiâ¦
 How does this chapter redefine what trauma looks like?,It challenges the idea that only abuse or violence counts as trauma Instead it presents subtle everyday experienceslike emotional displacement parental stress or lost connectionas deeply woundingâUnearthing and Overcomiâ¦
 Why is early recognition of Silent Trauma so important?,Because these traumas are invisible and unspoken they often go unhealed Recognizing them early allows for timely intervention and the chance to reestablish emotional security before long-term damage occursâUnearthing and Overcomiâ¦
 What role should parents and caregivers play in preventing these traumas?,Parents must remain emotionally attuned validate their childs experiences and maintain strong consistent bondsespecially during times of change or stressâUnearthing and Overcomiâ¦
 What is the key message of Chapter ?,Silent Trauma is not always dramaticits often subtle quiet and persistent Emotional abandonment witnessing conflict or being overlooked in the family dynamic can leave scars just as deep as more obvious forms of abuseâUnearthing and Overcomiâ¦
 What is one of the most important steps in identifying Silent Trauma?,Recognizing subtle behavioral signslike tantrums withdrawal or compulsive behaviorsas possible indicators of deeper emotional pain rather than just misbehaviorâUnearthing and Overcomiâ¦
 How does Silent Trauma manifest in early childhood behavior?,It can show up as tantrums excessive crying erratic eating or sleep and clinginess These are not âbad behaviorsâ but often unconscious expressions of distress fear or insecurityâUnearthing and Overcomiâ¦
 What is emotional regression and how is it connected to trauma?,Emotional regression refers to behaviors like bedwetting or thumb sucking in older children It often reflects a subconscious attempt to return to a safer emotional stage after traumaâUnearthing and Overcomiâ¦
 Why is separation anxiety a red flag for Silent Trauma?,Children with unresolved trauma may become unusually clingy or fearful of being away from caregivers This indicates a fear of abandonment rooted in earlier emotional woundsâUnearthing and Overcomiâ¦
 How can Silent Trauma affect school-age children?,Children may exhibit social withdrawal school refusal inattention or somatic complaints like headaches or stomachaches These are indirect expressions of unresolved emotional painâUnearthing and Overcomiâ¦
 Why are trauma symptoms often misinterpreted by adults?,Because they often resemble typical behavior or mental health disorders like ADHD anxiety or defiance Without awareness of trauma history caregivers and educators may respond with punishment instead of empathyâUnearthing and Overcomiâ¦
