question,answer
 How does neglectful parenting (often disguised as achievement-oriented) harm children?,It substitutes emotional presence with monetary rewards Trauma survivors may internalize that their worth is tied to performance triggering deep feelings of insignificance and resentmentâUnearthing and Overcomiâ¦
 What emotional outcomes are linked to achievement-oriented parenting?,Children may become narcissistic counter-dependent or obsessive achievers Despite material success they often feel unloved or emotionally emptyâUnearthing and Overcomiâ¦
 How does over-involved parenting (helicoptertiger style) reinforce dependency?,Children may not develop autonomy Trauma survivors may feel incapable of handling challenges resulting in increased anxiety and dependence on external approvalâUnearthing and Overcomiâ¦
 What unintended messages do over-involved parents send to traumatized children?,That the world is unsafe without strict oversight This fuels a controlling fear-based mindset and suppresses healthy risk-taking and decision-makingâUnearthing and Overcomiâ¦
 Why might even authoritative parenting fall short for trauma survivors?,Though balanced in structure and warmth it may still emphasize consequences over emotional healing Trauma survivors need validation and empathy before they can truly learn from mistakesâUnearthing and Overcomiâ¦
 What happens when authoritative parenting emphasizes independence too early?,Children stuck in early emotional development stages may not be ready Without emotional repair first teaching responsibility through consequences may feel like rejectionâUnearthing and Overcomiâ¦
 What do tragic cases like Columbine or Harper-Mercer suggest about conventional parenting?,That consequences and responsibilitywithout empathy and trauma carecan lead to emotional suppression resentment and dangerous outburstsâUnearthing and Overcomiâ¦
 What alternative does the book propose to conventional parenting?,The Stage  parenting model rooted in empathy and rehabilitation which emphasizes emotional presence healing dialogue and long-term connection over short-term controlâUnearthing and Overcomiâ¦
 How does Roland Kim's model critique the US disciplinary system?,It mirrors Stage  parentingrigid and consequence-drivenbut has failed to reduce incarceration and violence It lacks the empathic framework needed for healing-rooted behavior changeâUnearthing and Overcomiâ¦
 What is the most urgent parenting shift proposed in this chapter?,Moving from reaction-based discipline to empathy-based engagement Trauma survivors need emotional attunement firstbefore limits before logic and before lessonsâUnearthing and Overcomiâ¦
 What is the central idea of this chapter?,Parenting styles are not just strategiesthey are shaped by the emotional and personality development of the parents themselves A parents stage of emotional arrest often determines their caregiving behavior and emotional blind spotsâUnearthing and Overcomiâ¦
 What are the five parent personality types in Kims model?,Stage : Dependent-Authoritarian; Stage : Counter-dependent-Competitive; Stage : Socio-dependent-Controlling; Stage : Independent-Libertarian; Stage : Inter-independent-ActualizingâUnearthing and Overcomiâ¦
 What parenting styles are linked to Stage  arrestment?,Authoritarian permissive and over-involved parenting These styles emerge from fear-driven control patterns and project dependency needs onto childrenâUnearthing and Overcomiâ¦
 How does a Stage  personality influence parenting?,Stage  parents may demand strict obedience or become overly indulgent to maintain a false sense of control or safety They often equate rule-following with love and protectionâUnearthing and Overcomiâ¦
 What kind of children do Stage  parents tend to raise?,Children who become highly dependent authority-seeking or struggle with self-direction due to internalized beliefs that obedience ensures emotional safetyâUnearthing and Overcomiâ¦
 What parenting style is linked to Stage  (ego-building) arrestment?,Achievement-oriented or neglectful parenting These parents prioritize success and control over emotional presence often unintentionally raising narcissistic or counter-dependent childrenâUnearthing and Overcomiâ¦
 How does a Stage  parent typically behave?,They are often self-absorbed career-driven and compensate for emotional absence with rewards Their children may feel unseen unless they are achieving something notableâUnearthing and Overcomiâ¦
 What is a typical child response to Stage  parenting?,The child may become competitive perfectionistic or emotionally detached seeking validation through external performance rather than secure attachmentsâUnearthing and Overcomiâ¦
 How is indirect parenting tied to Stage  (conscience-building)?,Stage  parents use non-confrontational methods and emphasize manners and humility This may cultivate social awareness but also fosters over-compliance and emotional suppressionâUnearthing and Overcomiâ¦
 What parenting pattern arises from Stage  (self-esteem-building) personalities?,Authoritative parenting These parents are independent value logic and fairness and focus on teaching responsibilitybut may overlook emotional depth or trauma sensitivityâUnearthing and Overcomiâ¦
 Whats the risk if a Stage  parent raises a trauma survivor?,These parents may expect too much self-regulation and accountability before the child has healed Their well-meaning structure may feel emotionally cold or invalidating to a wounded childâUnearthing and Overcomiâ¦
 What characterizes Stage  (inter-independent) parenting?,These are empathic emotionally mature parents who combine structure emotional safety and adaptive communication They parent from a place of wholeness not woundingâUnearthing and Overcomiâ¦
 What is the ultimate goal of parenting in this model?,To evolve toward Stage  empathybalancing emotional presence with structure allowing children to develop autonomy resilience and secure attachmentsâUnearthing and Overcomiâ¦
 Why do authoritarian parenting strategies often fail traumatized children?,Because this style relies on fear and control it replicates the child's original trauma of helplessness and powerlessness reinforcing emotional wounds instead of healing themâUnearthing and Overcomiâ¦
 What are the risks of using punishment-based discipline with trauma survivors?,Such tactics may escalate resentment and rebellion especially in adolescence when the child gains more autonomy Instead of teaching accountability it reinforces fear and emotional shutdownâUnearthing and Overcomiâ¦
 How can permissive parenting cause harm to emotionally wounded children?,Permissiveness gives too much freedom without emotional containment This overwhelms the child who may misuse power or lash out in search of boundaries and emotional validationâUnearthing and Overcomiâ¦
 Why is giving a traumatized child too much decision-making power dangerous?,It burdens the child with emotional responsibilities beyond their capacity causing anxiety confusion and in some cases abusive or manipulative behaviorsâUnearthing and Overcomiâ¦
 How does achievement-oriented or neglectful parenting reinforce trauma?,When parents substitute emotional connection with money or praise children may feel unimportant This can trigger resentment and narcissistic or counter-dependent traitsâUnearthing and Overcomiâ¦
 What outcomes are linked to neglectful parenting in trauma cases?,These include increased depression insecurity and emotional isolation Children may grow up believing material success is more important than their emotional well-beingâUnearthing and Overcomiâ¦
 Why might over-involved (helicoptertiger) parenting backfire?,This style may feel smothering or controlling Emotionally wounded children often react with resistance or hostility feeling unseen or misunderstood beneath the pressure to achieveâUnearthing and Overcomiâ¦
 How does over-involvement escalate anxiety in trauma survivors?,It amplifies their emotional fragility by suppressing their need for autonomy and internal regulation increasing dependency and emotional volatilityâUnearthing and Overcomiâ¦
 Can even authoritative parenting fail trauma survivors?,Yes Though balanced authoritative parenting may assume emotional readiness Trauma survivors may not benefit from consequences until their pain is acknowledged and healedâUnearthing and Overcomiâ¦
 What does the Sarah anecdote reveal about authoritative parenting?,Despite having âgoodâ parents Sarah couldnt learn from discipline because her trauma remained unaddressed Only therapy helped her internalize structureâUnearthing and Overcomiâ¦
 How does the book critique the US justice and educational system?,Both systems model Stage  âconsequence-drivenâ discipline These rigid approaches fail to reduce violence or incarceration because they ignore emotional healingâUnearthing and Overcomiâ¦
 What parenting model does the author advocate as an alternative?,The Stage  empathic parenting modelfocused on rehabilitation emotional presence and growthoffers trauma survivors the emotional nourishment required for true healingâUnearthing and Overcomiâ¦
 What tragic cases are used to highlight parenting failure?,The book discusses Dylan Klebold Eric Harris and Chris Harper-Mercer Each case illustrates how authoritarian or performance-based parenting may overlook hidden emotional woundsâUnearthing and Overcomiâ¦
 Whats the overall message of Chapter ?,Conventional parentingwhile effective for average childrenfails to heal trauma Emotionally wounded children require empathy connection and psychological rehabilitationnot just rulesâ
 What is the central message of Chapter ?,Even balanced well-structured parenting styles like authoritative parenting can fail emotionally wounded children if they do not first address the childs trauma and emotional needsâUnearthing and Overcomiâ¦
 How did Dylan Klebold and Eric Harris demonstrate the failure of authoritative parenting?,Their parents followed traditional authoritative parenting with high expectations and support But their trauma and mental health struggles went unrecognized and their emotional distress escalated into the tragic Columbine High School massacreâUnearthing and Overcomiâ¦
 What critical oversight did Klebold and Harriss families possibly make?,They emphasized independence and consequences but failed to recognize or respond empathetically to deep emotional pain leading to unprocessed rage and isolationâUnearthing and Overcomiâ¦
 How does the story of Chris Harper-Mercer reinforce this message?,His mother valued personal responsibility and independence dismissing emotional struggles as weakness This rigid mindset may have contributed to her sons emotional breakdown and the tragic shooting he carried out at Umpqua Community CollegeâUnearthing and Overcomiâ¦
 What mindset in Harper-Mercers household exemplified this parenting limitation?,The belief that one should âstand on their own feet or fallâ ignored the need for emotional support in trauma recovery and may have re-traumatized instead of helpedâUnearthing and Overcomiâ¦
 Why does consequence-based discipline often fail with trauma survivors?,It assumes emotional readiness to learn from mistakes Traumatized children first need emotional validation healing and trust-building before they can internalize lessonsâUnearthing and Overcomiâ¦
 What happens when trauma survivors are disciplined without emotional support?,Their inner pain may be misunderstood as rebellion or laziness Punishment without empathy can escalate anxiety depression anger or even violenceâUnearthing and Overcomiâ¦
 What lesson can be drawn from these real-life tragedies?,Even the most respected parenting frameworks must evolve into trauma-informed empathic approaches to support children who are emotionally stuck in earlier developmental stagesâUnearthing and Overcomiâ¦
 What parenting model is recommended instead?,Stage  empathic parenting which combines emotional presence rehabilitation and long-term relational repair rather than simply enforcing responsibility through consequencesâUnearthing and Overcomiâ¦
 What do these cases tell us about broader societal approaches to discipline?,Our justice school and family systems often mirror Stage  logicfocused on rules and punishmentbut these approaches may fail to prevent harm unless they prioritize healingâUnearthing and Overcomiâ¦
 What is the main claim of this chapter?,While authoritative parenting is often praised it may not be enough for trauma survivors Dr Kim argues that a Stage  empathic parenting model is essential to meet the emotional needs of children who are emotionally arrested due to early traumaâUnearthing and Overcomiâ¦
 Why is authoritative parenting insufficient for trauma survivors?,It focuses on teaching responsibility through consequences but lacks the empathy and flexibility needed to address the underlying emotional wounds that drive troubling behaviorsâUnearthing and Overcomiâ¦
 What are the limitations of consequence-based parenting for trauma survivors?,Consequences are final and offer no room for repair or emotional correction Trauma survivors need healing before they can internalize lessons about behavior and responsibilityâUnearthing and Overcomiâ¦
 How can authoritative discipline re-traumatize children?,Trauma survivors may experience consequences as punishment or rejection reinforcing feelings of fear shame and powerlessness that were part of their original traumaâUnearthing and Overcomiâ¦
 What does the âStage â parenting model emphasize?,It emphasizes emotional rehabilitation empathy and mutual growth It assumes a more flexible and compassionate role for parents and systems in correcting and guiding behaviorâUnearthing and Overcomiâ¦
 Why is the US system compared to Stage  discipline in this chapter?,The US family educational and justice systems often teach responsibility through consequences but this rigid approach hasnt reduced incarceration or gun violence revealing its limits with trauma survivorsâUnearthing and Overcomiâ¦
 What are the key ingredients of Stage  empathic parenting?,Emotional validation non-punitive guidance room for rehabilitation and a relational approach to problem-solving that includes the emotional needs of the childâUnearthing and Overcomiâ¦
 What happens when consequences are imposed without understanding?,Children may shut down act out further or escalate into self-harm or aggression Without emotional attunement consequences often lead to more damage than growthâUnearthing and Overcomiâ¦
 What societal benefits might Stage  parenting bring?,If implemented broadly it could reduce behavioral disturbances school violence addiction and even criminality by addressing root emotional wounds before they manifest in externalized behaviorâUnearthing and Overcomiâ¦
 What is the call to action in this chapter?,To shift from behavior correction to emotional connectionto stop treating symptoms and instead address the root emotional pain This transformation must happen in homes schools and justice systemsâUnearthing and Overcomiâ¦
 What is the core takeaway from the book?,Trauma survivors require a fundamentally different parenting approachone rooted in empathy emotional support and understandingbefore boundaries or consequences can be effectiveâUnearthing and Overcomiâ¦
 Why dont traditional parenting methods work for trauma survivors?,Because they focus on fear control or reward systems These approaches ignore the deep emotional wounds trauma survivors carry and may even worsen their distressâUnearthing and Overcomiâ¦
 How does trauma arrest emotional development?,Traumaespecially from early childhoodcan freeze a childs emotional maturity at an earlier developmental stage This means they may behave younger than their age and need healing before behavioral correctionâUnearthing and Overcomiâ¦
 What is the risk of using consequences with trauma survivors?,Consequences can feel like rejection or abandonment If used before emotional healing they can lead to re-traumatization rebellion or deeper emotional shut-downâUnearthing and Overcomiâ¦
 What does Dr Kim's model propose as an alternative to consequence-based parenting?,Stage  empathic parenting which centers emotional connection validation and gradual rehabilitation instead of quick discipline or final judgmentsâUnearthing and Overcomiâ¦
 What kind of emotional climate must parents create to help trauma survivors heal?,An open and safe space where children can express even difficult emotions without fear of punishment Emotional safety builds trust and resilienceâUnearthing and Overcomiâ¦
 What societal shift does the book call for?,A shift from behavior-focused correction to emotional healing in homes schools and justice systemsso that acting-out children receive care rather than blameâUnearthing and Overcomiâ¦
 How are real-world tragedies like mass shootings connected to the books message?,Many mass shooters and individuals with severe emotional problems were raised in homes where trauma went unrecognized The book shows that even ânormalâ parenting may be insufficient without empathyâUnearthing and Overcomiâ¦
 What role do parents play in the healing of Silent Trauma?,A central one Parents must acknowledge trauma learn to speak emotional language and engage in continuous healing relationships with their childrenâUnearthing and Overcomiâ¦
 What is the books final call to action?,For families educators and leaders to move beyond traditional discipline and build systems grounded in empathy emotional repair and human connectionespecially for trauma survivorsâUnearthing and Overcomiâ¦
