question,answer
 Can a parents postpartum depression affect infant bonding?,Case  demonstrates that when a mother is emotionally distant due to depression the baby may internalize a lack of love developing attachment wounds and trust issues laterâUnearthing and Overcomiâ¦
 How do night-shift working mothers impact infant security?,In Case  the mother's nighttime absence disrupted the childs sleep and emotional sense of safety highlighting how even economic necessity can inadvertently cause Silent TraumaâUnearthing and Overcomiâ¦
 Whats the trauma of frequent family relocations?,Case  describes a baby moved between unfamiliar homes Constant environmental changes disrupt emotional regulation and the formation of secure attachmentâUnearthing and Overcomiâ¦
 Can being injured at preschool become a trauma?,Yes Case  involves a toddler waiting in pain after a fall Delayed parental presence even briefly may be experienced as abandonment imprinting fear and insecurityâUnearthing and Overcomiâ¦
 What is the significance of these anecdotes?,These cases show that trauma doesnt always stem from violence Often its the emotional absence the lack of empathy or breaks in trust that wound a childs heart the mosteven in otherwise normal familiesâUnearthing and Overcomiâ¦
 Why is early detection of Silent Trauma so crucial?,The first three years of life are a period of rapid brain development Trauma during this time can affect the prefrontal cortex amygdala and hippocampus potentially altering emotional regulation memory and executive functioning for lifeâUnearthing and Overcomiâ¦
 What are some immediate signs of Silent Trauma in infants?,These can include prolonged crying sleep disturbances irritability feeding difficulties and excessive clinginess These behaviors often reflect fear anxiety and an unmet need for safety and connectionâUnearthing and Overcomiâ¦
 Can a baby show signs of trauma before they can speak?,Yes Behaviors such as avoiding eye contact being unresponsive to caregivers or showing regression in sleep or feeding patterns can signal early trauma even in non-verbal infantsâUnearthing and Overcomiâ¦
 What is âregressionâ and how does it relate to trauma?,Regression is when a child reverts to earlier behaviorssuch as bedwetting thumb sucking or baby talkoften as a subconscious attempt to return to a time when they felt saferâUnearthing and Overcomiâ¦
 How can trauma affect social behavior in early childhood?,Children may become avoidant withdrawn or fearful in group settings Others may become overly anxious about leaving their caregiver or express intense separation anxietyâUnearthing and Overcomiâ¦
 What role does âclingingâ behavior play in identifying trauma?,A child who clings excessively may be experiencing internal fear or distress especially if they become panicked during short separations from the caregiverâUnearthing and Overcomiâ¦
 How do these symptoms tie into Dr Roland Kims five-stage personality theory?,Each developmental stage has corresponding emotional needs Trauma in a specific stage can arrest development and shape a childs personalityfor example creating authoritarian counter-dependent or perfectionist traits later in lifeâUnearthing and Overcomiâ¦
 Are these early trauma signs always loud or obvious?,No Many signs are subtle or mistaken for normal developmental phases Without awareness caregivers may dismiss behaviors that are actually red flags for emotional injuryâUnearthing and Overcomiâ¦
 Whats the main takeaway for caregivers and clinicians?,Seemingly small behaviorslike sleep trouble or frequent tantrumsmay be early expressions of Silent Trauma Empathy and careful attention are essential for healing and preventionâUnearthing and Overcomiâ¦
 What is Stage  in the Five-Stage Theory of Personality?,Stage  refers to the trust-building phase from birth to  months It is where the infant begins forming foundational attachment with the primary caregiver Trauma at this stage can disrupt the development of basic emotional securityâUnearthing and Overcomiâ¦
 What are immediate trauma signs in infants during this stage?,These include prolonged crying sleep difficulties feeding issues agitation irritability and clinginess These responses indicate emotional distress when the caregiver is absent or emotionally unavailableâUnearthing and Overcomiâ¦
 How does trauma affect sleep in infants?,Infants may struggle to fall asleep or wake frequently during the night This restlessness often stems from anxiety or emotional distress related to inconsistent caregivingâUnearthing and Overcomiâ¦
 Why might an infant cry excessively without a clear reason?,Excessive crying may signal fear emotional abandonment or overwhelming anxietyespecially in environments where caregivers are unavailable or emotionally unresponsiveâUnearthing and Overcomiâ¦
 What does clinginess reveal about an infants trauma response?,A traumatized infant may cling to the mother or primary caregiver excessively as a survival response to emotional insecurity The baby may panic when the caregiver is out of sightâUnearthing and Overcomiâ¦
 Is trauma more noticeable after  months of age?,Yes Around  months attachment deepens At this point trauma from separation can have a greater emotional impact because the infant has begun to expect safety and consistency from the caregiverâUnearthing and Overcomiâ¦
 Why is it important to recognize these signs early?,Early traumaespecially at Stage sets the foundation for emotional development If ignored the child may grow up with attachment disorders anxiety or trust issues that persist into adulthoodâUnearthing and Overcomiâ¦
 What distinguishes these signs from normal baby behavior?,The duration and intensity Occasional crying or clinginess is normal but prolonged symptoms that dont respond to soothing may indicate deeper emotional distressâUnearthing and Overcomiâ¦
 How should caregivers respond to these signs?,With consistent emotional presence physical affection and gentle soothing Building predictable routines and being emotionally attuned to the child helps reverse early trauma effectsâUnearthing and Overcomiâ¦
 What is the key message of Chapter ?,Even before a baby can speak their body and behavior tell the story of trauma Caregivers must learn to recognize and respond with empathy to ensure emotional safety from the very startâUnearthing and Overcomiâ¦
 What is Stage  in Dr Roland Kims developmental model?,Stage  covers the period from  to  months of age when children begin forming ego boundaries and developing a stronger sense of self It is a critical time for emotional independence and connection
 What does it mean when a child stops crying altogether during distress?,This can indicate trauma The child may have learned that their needs wont be met leading to emotional shutdown and hopelessnessa form of repressed anger and despairâUnearthing and Overcomiâ¦
 Why might a toddler appear peaceful on the outside but have random anger outbursts?,These children may suppress their true emotions to appear calm but periodically release built-up emotional pain through sudden rage It reflects unresolved trauma and repressionâUnearthing and Overcomiâ¦
 How does apathy show up in toddlers with trauma?,Apathy may manifest as indifference toward people including caregivers This detachment suggests a defense mechanism against further emotional hurtâUnearthing and Overcomiâ¦
 What is physical detachment and why is it alarming?,A child may physically avoid or distance themselves from their caregiver It is a protective behavior rooted in trauma signaling a fear of further emotional harmâUnearthing and Overcomiâ¦
 Why do some toddlers show no emotional response to a parents affection?,Emotional disconnect or trauma can lead to a shutdown of feelings The child may appear numb no longer expecting emotional nourishment or connectionâUnearthing and Overcomiâ¦
 What does âself-focused behaviorâ indicate in a toddler?,The child may seem emotionally self-sufficient or self-centered ignoring the parents cues This can be a coping mechanism developed from unmet emotional needsâUnearthing and Overcomiâ¦
 How do these signs differ from normal toddler independence?,Healthy independence still includes emotional connection and comfort-seeking In contrast trauma-related behaviors show withdrawal emotional flatness or bursts of unexplained angerâUnearthing and Overcomiâ¦
 What are caregivers often unaware of during this stage?,Many caregivers misinterpret withdrawal or clinginess as typical developmental behavior overlooking that they may signal Silent Trauma related to unmet emotional needsâUnearthing and Overcomiâ¦
 What is the core message of Chapter ?,At this stage children begin to assert themselves emotionally Trauma can either stunt that process or twist it into self-centeredness or emotional detachment Empathy and consistent emotional availability are vital for healthy developmentâUnearthing and Overcomiâ¦
 What is Stage  in Dr Roland Kims personality development model?,Stage  spans from  to  months and is described as the âconscience-building stageâ Children begin to develop emotional awareness of self versus others and form the building blocks of empathy guilt and basic social boundariesâUnearthing and Overcomiâ¦
 What trauma signs appear at this stage of development?,Children may show excessive guilt regressive behavior intense preoccupation with their mother solo play with detachment from surroundings and avoid social interactionâUnearthing and Overcomiâ¦
 Why is solo play without interaction a red flag at this age?,While independent play is normal isolation paired with a lack of curiosity or connection to others may indicate a trauma response such as avoidance or emotional withdrawalâUnearthing and Overcomiâ¦
 How does excessive concern for the mother show trauma?,The child may constantly monitor the mother showing anxiety over her safety or emotions This hypervigilance may reflect a subconscious fear of abandonment or emotional instability in the parent-child relationshipâUnearthing and Overcomiâ¦
 What does it mean when a child feels guilty for things beyond their control?,Trauma can cause children to internalize blame They might think they caused distress in othersespecially their caregivereven when they had no responsibilityâUnearthing and Overcomiâ¦
 How do regressive behaviors function as trauma signals?,A child may revert to earlier developmental behaviors (eg baby talk clinging bedwetting) as a coping strategy to regain a sense of safety and comfort lost due to traumaâUnearthing and Overcomiâ¦
 Why might a child avoid social activities during this stage?,Trauma-related anxiety may lead them to isolate to avoid judgment overstimulation or emotional risk This can reflect an early pattern of avoidance that may persist into later childhoodâUnearthing and Overcomiâ¦
 Whats the danger of misreading these behaviors as shyness or stubbornness?,Caregivers might miss the deeper emotional need failing to intervene with empathy and support These patterns may harden into attachment insecurity or personality vulnerabilitiesâUnearthing and Overcomiâ¦
 What emotional states dominate trauma responses at this stage?,Anxiety guilt and emotional sensitivityespecially toward caregiver reactionsare common These may manifest in controlling behavior excessive helpfulness or internal conflictâUnearthing and Overcomiâ¦
 What is the key parenting guidance for Stage  trauma signs?,Respond with reassurance emotional validation and consistent presence Help children separate their worth from external outcomes and gently correct guilt-based misinterpretationsâUnearthing and Overcomiâ¦
 What is the Latency Stage in child development?,The latency stage spanning ages  to  is when many early trauma symptoms become latent (hidden) Though emotional pain persists children may suppress outward expressions especially if their trauma was never validated or treatedâUnearthing and Overcomiâ¦
 Why do symptoms of trauma often appear hidden during this stage?,Children may have learned to mask their pain either to avoid consequences or because their emotional needs were ignored As a result behaviors may seem mild or unrelated to trauma but are often deeply rooted in itâUnearthing and Overcomiâ¦
 What are signs of trauma in a school-age child that might be mistaken for ADHD?,Difficulty focusing daydreaming restlessness or fidgeting may be trauma responsesnot just attention disorders These behaviors reflect an overloaded nervous systemâUnearthing and Overcomiâ¦
 How does trauma affect a childs learning and academic performance?,Emotional distress compromises memory focus and motivation A traumatized child may struggle with reading following instructions or completing assignments despite average intelligenceâUnearthing and Overcomiâ¦
 What is the connection between trauma and attention-seeking behavior?,Children who feel unseen may act out or misbehave to gain any form of attentioneven negative This is often a disguised plea for emotional connectionâUnearthing and Overcomiâ¦
 How can trauma lead to school avoidance or social phobia?,Emotional wounds may create deep anxiety in group settings School may feel overwhelming or unsafe triggering avoidance stomachaches or extreme clinginessâUnearthing and Overcomiâ¦
 What does frequent daydreaming or doodling reveal about a childs emotional state?,These can be self-soothing tools The child may use imagination or repetitive drawing to escape distressing emotions they cant yet process verballyâUnearthing and Overcomiâ¦
 Can trauma result in bullying or being bullied?,Yes Some children cope by becoming aggressive or verbally abusive Others become hypersensitive making them easy targets Both roles can stem from unresolved traumaâUnearthing and Overcomiâ¦
 Why might a child begin lying stealing or breaking rules?,These behaviors may be maladaptive strategies for regaining a sense of power or control in a life that feels emotionally unsafe or unpredictableâUnearthing and Overcomiâ¦
 What are somatic symptoms and how do they relate to trauma?,Stomachaches headaches or even skin problems may reflect underlying emotional distress Children often express psychological pain through physical complaintsâUnearthing and Overcomiâ¦
 What addictive tendencies can begin during latency stage trauma?,Children may develop compulsive behaviors like overeating excessive gaming or obsessively engaging in certain routines to manage inner anxietyâUnearthing and Overcomiâ¦
 What role do obsessive-compulsive behaviors play in latency-age trauma?,Repetitive rituals or rigid thinking can serve as attempts to create emotional stability in a chaotic internal world It may help the child feel a temporary sense of controlâUnearthing and Overcomiâ¦
 What does it mean to be emotionally arrested at Stage ?,It means the child experienced trauma during the trust-building stage (â months) and as a result their emotional development was disrupted often leading to lifelong struggles with safety attachment and emotional regulationâUnearthing and Overcomiâ¦
 How might this early trauma show up as anxiety later in life?,A common symptom is âmorning bluesâ or intense morning anxiety which can escalate into panic attacks This reflects unresolved fear and emotional distress carried from infancyâUnearthing and Overcomiâ¦
 Why do people arrested at Stage  often strive for perfection?,Perfectionism becomes a defense mechanism to manage anxiety and internal chaos It is often accompanied by obsessive-compulsive behaviors aimed at avoiding feelings of failure or shameâUnearthing and Overcomiâ¦
 How can early trauma affect eating behaviors?,Eating disorders such as anorexia bulimia or binge eating may develop as maladaptive coping mechanisms to manage emotional voids or regain a sense of controlâUnearthing and Overcomiâ¦
 What are common physical symptoms linked to early trauma?,Trauma can manifest somatically through headaches skin issues stomachaches or asthmaoften with no clear medical cause but linked to suppressed emotional painâUnearthing and Overcomiâ¦
 How does trauma from infancy affect attention and focus?,It often leads to distractibility daydreaming and difficulty maintaining attention which may be mistaken for ADHDâUnearthing and Overcomiâ¦
 What types of addictions may form from unresolved early trauma?,Both chemical (eg opioids sedatives) and behavioral addictions (eg shopping gaming or social media) may emerge as coping tools for managing deep psychic painâUnearthing and Overcomiâ¦
 Why is insomnia common in trauma survivors from this stage?,Sleep is often disrupted by anxiety or nightmares Teeth-grinding during sleep is also a common sign of suppressed emotional tensionâUnearthing and Overcomiâ¦
 How do early attachment wounds affect adult relationships?,Individuals may struggle to trust others fear abandonment or feel lonely even in close relationships Relationship dynamics often mirror early caregiver detachmentâUnearthing and Overcomiâ¦
 What kinds of emotional dysregulation are common at this stage?,Outbursts of anger impulsive behaviors and an inability to manage intense emotions are frequent These can lead to risky behavior or inappropriate emotional expressionâUnearthing and Overcomiâ¦
 Can trauma at this stage lead to severe mental health crises?,Yes Individuals may develop suicidal or even homicidal thoughts often rooted in feelings of unworthiness emotional void or fear of being unloved or abandonedâUnearthing and Overcomiâ¦
 What distorted thinking patterns might appear?,Black-and-white thinking prejudice fear of abandonment and chronic loneliness are common These thought patterns often limit emotional growth and interpersonal flexibilityâUnearthing and Overcomiâ¦
 What are potential identity issues related to this stage?,Survivors may struggle with body image gender identity or sexual orientation These identity issues can reflect early emotional disconnection from the self and othersâUnearthing and Overcomiâ¦
 How might these individuals behave in relationships?,They may exhibit dependency manipulation or vengeful behaviorsoften driven by fear of rejection and a desperate need for validation and emotional controlâUnearthing and Overcomiâ¦
 What does it mean to be âarrestedâ at Stage ?,It means emotional trauma occurred between â months of ageduring the ego-building phasedisrupting the development of healthy boundaries independence and self-imageâUnearthing and Overcomiâ¦
 What are common personality traits of someone arrested at Stage ?,Traits include emotional detachment narcissism selfishness and exploitation of others to meet personal needsâUnearthing and Overcomiâ¦
 How does unresolved trauma from this stage affect relationships?,Individuals may struggle to form authentic connections relying on superficial transactional relationships and maintaining a favorable image rather than emotional intimacyâUnearthing and Overcomiâ¦
 Why do people with this arrestment struggle with shame?,They often suppress feelings of vulnerability and weakness This leads to denial of flaws and hypersensitivity to criticism creating a fragile self-imageâUnearthing and Overcomiâ¦
 What attention-seeking behaviors are common?,These individuals may become obsessed with achievement fame or success crafting a âperfectâ public identity while hiding emotional emptinessâUnearthing and Overcomiâ¦
 What coping mechanisms do they tend to use?,They may use obsessive image-control cosmetic procedures substance abuse (eg stimulants or hallucinogens) and perfectionism to maintain emotional controlâUnearthing and Overcomiâ¦
 How does paranoia or mistrust manifest at this stage?,A person may become overly suspicious of others' motives fearing betrayal or loss of control This can lead to controlling or manipulative behaviorâUnearthing and Overcomiâ¦
 Why is admitting weakness or failure so difficult for them?,Their fragile ego equates failure with personal annihilation They often develop overconfidence as a mask for deep insecurityâUnearthing and Overcomiâ¦
 What are signs of emotional instability or splitting?,They may display black-and-white thinkingidolizing someone one moment and demonizing them the nextas a way to manage internal emotional chaosâUnearthing and Overcomiâ¦
 Can these individuals experience real emotional connection?,Often no Due to early emotional wounding they may struggle to connect authentically with others preferring pets or fantasy over vulnerable human intimacyâUnearthing and Overcomiâ¦
 What are red flags of false-self development?,A person may construct a self-image based on external success or attention which doesn't match their internal emotional statecreating deep internal conflictâUnearthing and Overcomiâ¦
 What is the overall message of Chapter ?,Trauma at the ego-building stage leads to an inflated or fragile sense of self The solution lies not in more achievement but in healing early emotional wounds through empathy vulnerability and emotional reconnectionâUnearthing and Overcomiâ¦
 What does it mean to be emotionally arrested at Stage ?,Arrestment at Stage  (â months) means trauma occurred during the conscience-building phase where the child first starts developing empathy moral awareness and guilt Trauma during this stage often leads to deep-rooted control issues internalized guilt and social anxiety later in lifeâUnearthing and Overcomiâ¦
 What are common adult symptoms of Stage  trauma arrestment?,Symptoms include social anxiety excessive guilt avoidance of confrontation rigid rule-following emotional suppression and a strong need to appease others even at personal costâUnearthing and Overcomiâ¦
 How does trauma at this stage affect emotional expression?,Individuals may suppress anger or sadness in order to maintain harmony or avoid judgment They may also blame themselves excessively and have difficulty asserting emotional boundariesâUnearthing and Overcomiâ¦
 Why do some trauma survivors develop obsessive-compulsive behaviors?,These behaviors stem from a hyperactive conscience or fear of violating internal moral rules Rituals or strict routines offer a sense of control and reduce anxietyâUnearthing and Overcomiâ¦
 What is âafternoon bluesâ and how is it related to Stage  trauma?,Many with Stage  trauma report feeling drained or depressed in the afternoon due to the emotional effort of maintaining perfection control or social âmaskingâ earlier in the dayâUnearthing and Overcomiâ¦
 How does trauma at this stage affect social behavior?,People may live in social isolation avoid conflict or become overly dependent on rules and routines They tend to fear emotional risk and may struggle with trust and intimacyâUnearthing and Overcomiâ¦
 What kinds of coping strategies are common?,Relaxant abuse (eg alcohol) ritualistic behavior and appeasement strategies like over-apologizing or excessive people-pleasing are often used to soothe internal distressâUnearthing and Overcomiâ¦
 Can sexual behaviors also reflect trauma from this stage?,Yes Some individuals may develop fetishistic or compulsive sexual behaviors as a way to cope with unresolved inner anxiety guilt or shameâUnearthing and Overcomiâ¦
 What are common identity challenges faced by individuals with this trauma profile?,They may struggle with self-worth fear of moral failure or confusion between their true needs and their internalized image of being âgoodâ or âacceptableâ to othersâUnearthing and Overcomiâ¦
 How does decision-making get affected?,Due to fear of failure or disappointing others they may find it very difficult to make choices and may require constant reassuranceâUnearthing and Overcomiâ¦
 What is the role of therapy for this stage of trauma?,Therapy focused on dismantling guilt-driven behavior supporting emotional self-expression and helping the individual rebuild self-worth is essential for healingâ
 Why does authoritarian parenting fail trauma survivors?,Authoritarian parenting relies on fear and obedience For children with trauma histories it reactivates feelings of powerlessness and fear worsening emotional wounds rather than healing themâUnearthing and Overcomiâ¦
 What emotional risks come from authoritarian discipline in adolescence?,It can trigger deep resentment and rage As children gain independence they may rebel fiercely acting out unresolved emotional pain with aggression or withdrawalâUnearthing and Overcomiâ¦
 How does permissive parenting affect trauma survivors?,Permissive parenting gives children too much power without emotional structure Trauma survivors can become overwhelmed unstable or even abusive in response to the lack of boundariesâUnearthing and Overcomiâ¦
 Why is permissive parenting emotionally dangerous?,Without clear limits children may interpret the lack of guidance as emotional abandonment This can fuel insecurity and even revenge-seeking behaviors in later yearsâUnearthing and Overcomiâ¦
